{
  "claim_id": "dc_9K1X3P7Q",
  "domain": "example.com",
  "requestor": {
    "business_email": "security@example.com",
    "display_name": "Jane Doe",
    "organization": "Example Inc"
  },
  "verification_method": "dns_txt",
  "status": "pending",
  "created_at": "2026-04-03T12:00:00Z",
  "expires_at": "2026-04-05T12:00:00Z"
}
